{
  "$schema": "https://json-schema.org/draft/2020-12/schema",
  "$id": "https://alveqio-infrastructure.github.io/openops-evidencekit/schemas/evidence.schema.json",
  "title": "OpenOps Evidence",
  "type": "object",
  "additionalProperties": true,
  "required": ["schema_version", "generated_at", "metadata", "assets", "signals"],
  "properties": {
    "schema_version": {
      "type": "string",
      "pattern": "^0\\.1(\\.\\d+)?$"
    },
    "generated_at": {
      "type": "string",
      "format": "date-time"
    },
    "metadata": {
      "type": "object",
      "additionalProperties": true
    },
    "assets": {
      "type": "array",
      "items": {
        "$ref": "#/$defs/asset"
      }
    },
    "signals": {
      "type": "object",
      "additionalProperties": true
    }
  },
  "$defs": {
    "asset": {
      "type": "object",
      "additionalProperties": true,
      "required": ["id", "type"],
      "properties": {
        "id": {
          "type": "string",
          "minLength": 1
        },
        "type": {
          "type": "string",
          "minLength": 1
        },
        "hostname": {
          "type": "string"
        },
        "roles": {
          "type": "array",
          "items": {
            "type": "string"
          }
        },
        "tags": {
          "type": "array",
          "items": {
            "type": "string"
          }
        }
      }
    }
  }
}
