{
  "schema_version": "0.1",
  "generated_at": "2026-05-31T10:00:00+00:00",
  "metadata": {
    "source": "example",
    "organization": "Example Operations Team",
    "environment": "production"
  },
  "assets": [
    {
      "id": "web-01",
      "type": "host",
      "hostname": "web-01.example.invalid",
      "roles": ["web"],
      "tags": ["linux", "customer-facing"]
    },
    {
      "id": "backup-repo-01",
      "type": "backup-repository",
      "hostname": "backup.example.invalid",
      "roles": ["backup"],
      "tags": ["restic"]
    }
  ],
  "signals": {
    "backup": {
      "tool": "restic",
      "last_success_at": "2026-05-30T22:10:00+00:00",
      "restore_test_at": "2026-05-18T13:30:00+00:00",
      "repository_count": 1
    },
    "monitoring": {
      "system": "prometheus",
      "targets": 12,
      "alert_channels": ["email", "matrix"],
      "last_alert_test_at": "2026-05-25T08:15:00+00:00"
    },
    "access": {
      "ssh_public_exposed": false,
      "mfa_required": true,
      "admin_entrypoints": ["vpn", "sso"]
    },
    "tls": {
      "certificates": [
        {
          "hostname": "www.example.invalid",
          "not_after": "2026-08-20T12:00:00+00:00",
          "issuer": "Example CA"
        }
      ]
    },
    "docs": {
      "inventory_updated_at": "2026-05-29T16:45:00+00:00",
      "runbooks": [
        {
          "name": "backup-restore",
          "updated_at": "2026-05-22T09:00:00+00:00"
        },
        {
          "name": "incident-escalation",
          "updated_at": "2026-05-20T09:00:00+00:00"
        }
      ]
    },
    "mail": {
      "domains": [
        {
          "domain": "example.invalid",
          "spf": true,
          "dkim": true,
          "dmarc": "quarantine"
        }
      ]
    }
  }
}
